,id,title,labels,scores,status
14269,iV8y1taOCG,Evolving LLMs' Self-Refinement Capability via Synergistic Training-Inference Optimization,unlabeled,"[2,2,4,8]",Withdraw
1912,5vk1wPDbpk,Revisiting Hypernetwork in Model-Heterogeneous Personalized Federated Learning,unlabeled,"[2,2,4,6]",Withdraw
2362,7Q2x2geWT3,EXPONENTIAL MAP MODELS AS AN INTERPRETABLE FRAMEWORK FOR GENERATING NEURAL SPATIAL REPRESENTATIONS,unlabeled,"[2,4,6,10]",Reject
19009,xVO4BqmzVD,SpecRA: Monitor Degenerative Repetition in LLM Agents using Randomized FFT,unlabeled,"[4,4,4,6]",Reject
7450,NOkjJPJIit,Active Learning for Decision Trees with Provable Guarantees,unlabeled,"[4,4,6,8]",Poster
8020,PA0F35JTkf,DONOD: Efficient and Generalizable Instruction Fine-Tuning for LLMs via Model-Intrinsic Data Selection,unlabeled,"[4,4,4,4]",Reject
8379,QDLGcnYdxe,Rrls: Robust reinforcement learning suite,unlabeled,"[2,2,2,2]",Reject
9266,StD1GnueIb,GeoReasoning: Structured Semantic Reasoning for Image-to-Map Localization,unlabeled,"[2,2,2,8]",Reject
9858,UcLHElOYRG,HEAR: High-frequency Enhanced Autoregressive Modeling for Identity-Preserving Image Generation,unlabeled,,Withdraw
356,10XgR4QORn,Analyzing and Internalizing Complex Policy Documents for LLM Agents,unlabeled,"[4,4,6,6]",Withdraw
14875,kL3pz7YSQF,"Text-to-Image Diffusion Models Cannot Count, and Prompt Refinement Cannot Help",unlabeled,"[4,4,4,6]",Reject
4806,F8o9gzJFxr,A Generative Likelihood Framework for High-Resolution Climate Model Evaluation,unlabeled,"[2,4,4,6]",Reject
1638,57q8qtE5Ih,Robust Direct Preference Optimization via Variational form f-divergence,unlabeled,"[2,2,4,4]",Withdraw
5103,G4b2e0oJEN,Interactive and Explainable Graph Neural Networks with Uncertainty Awareness and Adaptive Human Feedback,unlabeled,"[2,2,2,4]",Withdraw
137,0R6HLWvWYk,Test-Time Adaptation without Source Data for Out-of-Domain Bioactivity Prediction,unlabeled,"[2,2,6,6]",Poster
16324,opuQH9Xyu9,Multi-LLM Adaptive Conformal Inference for Reliable LLM Response,unlabeled,"[4,6,6,8]",Poster
14858,kIT1aA8SbY,Stability in Training PINNs for Stiff PDEs: Why Initial Conditions Matter,unlabeled,"[2,2,2,6]",Reject
15230,lQhBWz59qW,ePC: Overcoming Exponential Signal Decay in Deep Predictive Coding Networks,unlabeled,"[0,2,6,8]",Reject
16019,nruZar3Aaz,PhyMAGIC: Physical Motion-Aware Generative Inference with Confidence-guided LLM,unlabeled,"[2,4,4,6]",Withdraw
3891,CFewUmgIIL,Activation Steering for LLM Alignment via a Unified ODE-Based Framework,unlabeled,"[2,6,6,6]",Poster
8339,Q7mLKxQ8qk,Understanding the Mechanisms of Fast Hyperparameter Transfer,unlabeled,"[4,6,8,8]",Poster
2939,9HacBDFOjt,From Static Benchmarks to Dynamic Protocol: Agent-Centric Text Anomaly Detection for Evaluating LLM Reasoning,unlabeled,"[2,6,6,6]",Poster
5477,HDfQE1EWpC,DyBBT: Dynamic Balance via Bandit-inspired Targeting for Dialogue Policy with Cognitive Dual-Systems,unlabeled,"[4,4,4,6]",Withdraw
5620,HfIIRlPdba,SuperMIL: Supervised Multiple Instance Learning for Time Series Classification,unlabeled,"[2,2,4,4]",Reject
18691,wOaXd83Yio,Personalized Visual Representation Alignment for Generative Multimodal Recommendation,unlabeled,"[4,4,4,4]",Reject
284,0oqEBQA0UD,PeakNovo: Towards the Robust De Novo Peptide Sequencing for Missing Spectral Peaks,unlabeled,"[2,4,4,4]",Reject
8195,PeI4a4qeLY,StageVAR: Stage-Aware Acceleration for Visual Autoregressive Models,unlabeled,"[4,4,4,6]",Reject
1662,5DCQn5zVMn,ILPG: Instance-Level Prototype Generation for Zero-Shot Learning,unlabeled,"[2,4,6,6]",Desk Reject
3475,Ax02eR2c3d,Beyond Static Vision: Scene Dynamic Field Unlocks Intuitive Physics Understanding in Multi-modal Large Language Models,unlabeled,"[2,6,6,8]",Poster
10889,Y1VgLHbzCC,One Demo Is All It Takes: Planning Domain Derivation with LLMs from A Single Demonstration,unlabeled,"[4,6,6,6]",Poster
11012,YQ5wH5C69t,Dimple: Discrete Diffusion Multimodal Large Language Model with Parallel Decoding,unlabeled,"[2,4,4,6]",Reject
7485,NWoHQbALl4,Compositional HyperModules for Few-Shot Code Adaptation in Meta-Reinforcement Learning,unlabeled,"[2,2,2,2]",Reject
12928,eD8IPvNoZB,SLA: Beyond Sparsity in Diffusion Transformers via Fine-Tunable Sparse–Linear Attention,unlabeled,"[2,6,6,6]",Poster
3520,B5BpwOHPlW,Decoder Only Transformer for Physics Informed Neural Networks,unlabeled,"[2,2,4]",Withdraw
13893,hOywXVc7Qq,Achieving $\tilde{O}(1)$ Strong Constraint Violation and Sublinear Strong Regret in Online CMDPs,unlabeled,"[2,4,6,6]",Reject
17011,r3ot6ElBMq,Semantic Editing with Coupled Stochastic Differential Equations,unlabeled,"[2,4,4,6]",Reject
5050,FsfJ3lJhMJ,Bootstrapping World Models from Dynamics Models in Multimodal Foundation Models,unlabeled,"[2,2,4,6]",Withdraw
15721,msJgEkjwh5,CodeBrain: Towards Decoupled Interpretability and Multi-Scale Architecture for EEG Foundation Model,unlabeled,"[2,4,6,8]",Poster
7785,OSUunhrktW,THE-Tree: Can Tracing Historical Evolution Enhance Scientific Verification and Reasoning?,unlabeled,"[2,4,4,6]",Withdraw
14535,jKeOsMdMe5,Neural Latent Arbitrary Lagrangian-Eulerian Grids for Fluid-Solid Interaction,unlabeled,"[2,4,6,8]",Poster
13704,gqKw2hblMa,Scalable Element-wise Finite-Time Optimization for Deep Neural Networks,unlabeled,"[2,4,4,6]",Reject
1365,4J2e3nWiC8,Priors in time: Missing inductive biases for language model interpretability,unlabeled,"[4,6,8]",Poster
2591,84Av9JbTrM,Story2Screen: Multimodal Story Customization for Long Consistent Visual Sequences,unlabeled,"[2,4,4,6]",Withdraw
17696,tEI2PFk25l,Human-Prior Correction: Scalable Post-hoc Calibration that Aligns Vision Models with Human Uncertainty,unlabeled,"[2,2,2]",Desk Reject
540,1bUeVB3fov,How Do Coding Agents Spend Your Money? Analyzing and Predicting Token Consumptions in Agentic Coding Tasks,unlabeled,"[2,2,4,4]",Withdraw
19032,xaTmmj47Iu,Reward Model Generalization for Compute-Aware Test-Time Reasoning,unlabeled,"[2,4,6]",Withdraw
10048,VDg6Pv4S3v,Bayesian Test-Time Adaptation via Dirichlet feature projection and GMM-Driven Inference for Motor Imagery EEG Decoding,unlabeled,"[4,6,6]",Poster
5150,GD55nbjRaD,Terra: Explorable Native 3D World Model with Point Latents,unlabeled,"[2,4,4,4]",Withdraw
8627,Qvx7G5Fsy0,Vision-Centric Activation and Coordination for Multimodal Large Language Models,unlabeled,"[2,4,6,6]",Reject
15738,mwAkJJ4NBD,Coevolutionary Continuous Discrete Diffusion: Make Your Diffusion Language Model a Latent Reasoner,unlabeled,"[2,4,4,6]",Reject
14866,kJLRccGu9K,2D Quantization for Ultra‑low‑bit Optimizers,unlabeled,"[2,4,4,6]",Withdraw
3731,BjlmBIKQee,Sphinx: Visual Perception and Reasoning Gym,unlabeled,"[2,4,4,6]",Withdraw
17305,ryc6WtvwDQ,Does the Manipulation Process Matter? RITA: Reasoning Composite Image Manipulations via Reversely-Ordered Incremental-Transition Autoregression,unlabeled,"[2,4,6]",Withdraw
1756,5THcDkGGjt,Thinking with Camera: A Unified Multimodal Model for Camera-Centric Understanding and Generation,unlabeled,"[6,6,8,8]",Poster
14177,iE1z0EbvOD,SIFBench: An Extensive Benchmark for 3D Fatigue Analysis,unlabeled,"[4,4,4,6]",Reject
4565,EQ3TwO84Cs,Learn to Memorize: Optimizing LLM-based Agents with Adaptive Memory Framework,unlabeled,"[2,2,4,4]",Withdraw
14581,jSQPqdoidy,SK2Decompile: LLM-based Two-Phase Binary Decompilation from Skeleton to Skin,unlabeled,"[4,6,6,8]",Poster
3640,BS0PhDOaJ7,CUARewardBench: Benchmark for Evaluating Reward Models on Computer-using Agent Trajectories,unlabeled,"[2,4,4,8]",Reject
11828,avdPTUXdPG,Dissecting Demystifying Region-Based Representations in MLLMs,unlabeled,"[2,2,4,4]",Withdraw
5250,GUNUfIO7hs,Contextual Forgetting: Mitigating Knowledge Obsolescence for Safe Lifelong Robot Learning,unlabeled,"[2,4,4]",Reject
1131,3Z3Is6hnOT,Fast-dLLM: Training-free Acceleration of Diffusion LLM by Enabling KV Cache and Parallel Decoding,unlabeled,"[6,6,8,8]",Poster
4930,FWEGmkHTJX,Learning frequency domain codes for semantic vision,unlabeled,"[2,2,4,8]",Reject
11617,aHgG9Mps6A,Double Descent Revisited: When Noise Amplifies and Optimizers Decide,unlabeled,"[2,2,4,6]",Reject
6916,LfdFnakqGJ,A2ASecBench: A Protocol-Aware Security Benchmark for Agent-to-Agent Multi-Agent Systems,unlabeled,"[4,4,6,8]",Poster
3569,BDnOrExHmt,PixNerd: Pixel Neural Field Diffusion,unlabeled,"[4,8,8,8]",Poster
1772,5WBGG7vi8q,LIHE: Linguistic Instance-Split Hyperbolic-Euclidean Framework for Weakly-Supervised Generalized Referring Expression Comprehension,unlabeled,"[2,4,4,6]",Withdraw
8886,Ric2If6Xur,Difficulty-Aware Reasoning for Mobile GUI Automation via Reinforcement Fine-Tuning,unlabeled,"[2,4,4,4,4]",Reject
16556,pelxC06W8U,Block-Sample MAC-Bayes Generalization Bounds,unlabeled,"[4,4,8]",Poster
12829,dwgtYTuSaS,Continuous Online Action Detection from Egocentric Videos,unlabeled,"[2,2,4,4]",Withdraw
10830,Xpj0yeMhpz,Decoupling the Class Label and the Target Concept in Machine Unlearning,unlabeled,"[4,6,8,10]",Poster
11554,a4S1nQay3b,Uncover Underlying Correspondence for Robust Multi-view Clustering,unlabeled,"[6,6,8,8]",Oral
19792,zwZpT1ZBpl,Flagifying the Dowker Complex,unlabeled,"[2,6,6]",Withdraw
2031,6KrETIaOYD,Multi-Action Self-Improvement For Neural Combinatorial Optimization,unlabeled,"[4,6,6,6]",Poster
7257,MmYiosUoay,Seeing is Understanding: Unlocking Causal Attention into Modality-Mutual Attention for Multimodal LLMs,unlabeled,"[4,4,4,6]",Reject
14936,kXhh2lToaR,Low-Rank Few-Shot Node Classification by Node-Level Graph Diffusion,unlabeled,"[4,4,6,8]",Poster
2704,8SyEcWVe10,LVTINO: LAtent Video consisTency INverse sOlver for High Definition Video Restoration,unlabeled,"[4,6,6,6]",Poster
14017,hiU1rhYuFT,OFS: Overlapped Feature Synthesis for Communication-Efficient Federated Learning,unlabeled,"[2,2,4,4]",Reject
470,1NZ3DHF9nT,Fast-dLLM v2: Efficient Block-Diffusion LLM,unlabeled,"[4,6,6,8]",Poster
17234,rl79URrb3d,Rare Event Early Detection: A Dataset of Sepsis Onset for Critically Ill Trauma Patients,unlabeled,,Desk Reject
7259,Mn6Q4LWyiv,Human-like Supramodal Concept Learning Boosts Emotion Recognition,unlabeled,"[2,4,4,6]",Withdraw
4069,CoBxmXThM6,AgentSynth: Scalable Task Generation for Generalist Computer-Use Agents,unlabeled,"[2,6,6]",Poster
4441,E0udlUz8wQ,MultiMisD: Multimodal Misclassification Detection,unlabeled,"[2,2,6,6]",Withdraw
2457,7g74cnF6BJ,Should You Use Your LLM to Explore or Exploit?,unlabeled,"[0,2,4,6]",Reject
13751,gwysQdBY1q,Incentivizing Tool-augmented Thinking with Images for Medical Image Analysis,unlabeled,"[4,4,8]",Withdraw
16190,oRHmIKfBpq,Self-Improving Medical Visual Question Answering through Reasoning Trajectory Clustering,unlabeled,"[0,2,4,6]",Reject
7395,NDryJf9DSL,Aryabhata: An exam-focused language model for JEE Math,unlabeled,"[0,2,2,2]",Reject
15329,lhVrFEssk5,MATRIX: Mask Track Alignment for Interaction-aware Video Generation,unlabeled,"[2,8,8]",Poster
11369,ZRokRhD72w,Mini-Omni-Reasoner: Token-Level Thinking-in-Speaking in Large Speech Models,unlabeled,"[2,2,6,6]",Withdraw
15352,ll8GLAic7q,Do We Really Need Permutations? Impact of Width Expansion on Linear Mode Connectivity,unlabeled,"[4,4,6,6]",Poster
8860,RdLSJ5CJsr,MGAL: A Multilingual Granularity-Aware Long-context Benchmark,unlabeled,"[2,4,4,6]",Withdraw
9712,UElh7vzgKX,Scaling Goal-conditioned Reinforcement Learning with Multistep Quasimetric Distances,unlabeled,"[2,4,6,6,8]",Poster
17813,tds7TrLx9N,Teachers That Listen: Adaptive Student-Aware Distillation for Reasoning,unlabeled,"[2,4,4,4]",Reject
12448,coF6roWi9M,Improving Multi-step RAG with Hypergraph-based Memory,unlabeled,"[2,4,4,4]",Reject
17946,u4QjgKtD7Q,Improving Chain-of-Thought Efficiency for Autoregressive Image Generation,unlabeled,"[2,4,6]",Withdraw
3374,AcDx2tUZPb,DecompGAIL: Learning Realistic Traffic Behaviors with Decomposed Multi-Agent Generative Adversarial Imitation Learning,unlabeled,"[4,4,8]",Poster
16472,pOC02CX2A7,RAG Makes Guardrails Unsafe? Investigating Robustness of Guardrails under RAG-style Contexts,unlabeled,"[4,4,4,6]",Reject
489,1QTkoX8XHD,Efficient Facial Landmark Detection via Prior Knowledge-Guided Agents,unlabeled,"[4,4,4,6]",Reject
13369,fej4EppPMZ,Zero-to-Interaction: Generating Dynamic Videos from Synthetic State Transitions,unlabeled,"[2,4,4,4]",Withdraw
11823,atvss2zjTn,Fast Agnostic Learners in the Plane,unlabeled,"[2,2,6,6]",Withdraw
7352,N59cvpjnlo,POLLINATOR: OPTIMAL MATCHMAKING IN AN INTELLIGENCE MARKETPLACE,unlabeled,"[4,4,6,6]",Reject
8987,S1JJyWg1VG,Data-to-Energy Stochastic Dynamics,unlabeled,"[4,4,6,6]",Poster
6282,Jd0vNFVC7M,AttentionR-GCN: Incorporating Spatiotemporal Reasoning in Heterogeneous and Partially Observed Graphs,unlabeled,"[2,2,4]",Reject
4120,CxpKHWqT1n,MomentSeg: Moment-Centric Sampling for Enhanced Video Pixel Understanding,unlabeled,"[4,4,6,6]",Reject
1376,4LiX5ddGcU,Unified Vision–Language Modeling via Concept Space Alignment,unlabeled,"[4,6,6,6]",Poster
15088,kxVjQhkAWz,Dens3R: A Foundation Model for 3D Geometry Prediction,unlabeled,"[4,6,6,8]",Poster
309,0ucmlIQTlu,Personalized Feature Translation for Expression Recognition: An Efficient Source-Free Domain Adaptation Method,unlabeled,"[4,4,6]",Poster
13221,fBc9v8CVvm,TwinFlow: Realizing One-step Generation on Large Models with Self-adversarial Flows,unlabeled,"[4,6,6]",Poster
12491,cwOSdyuNh6,Enhanced Generative Model Evaluation with Clipped Density and Coverage,unlabeled,"[4,6,6,6]",Poster
14760,k2CKteHKZO,"Unified, Practical, and White-box Seismic Tomography with Automatic Differentiation",unlabeled,"[2,2,4,8]",Reject
12302,cNn18vs23o,CMQuant: A Quantization-Aware Parameter-Efficient Fine-Tuning Framework for 4-Bit Consistency Models,unlabeled,"[4,4,6]",Reject
6642,Kli9GFdYug,INTERPRETING QUANTUM CIRCUIT LEARNING WITH QPERT: A STEP TOWARD TRUSTWORTHY QUANTUM AI,unlabeled,"[2,2,2,6]",Reject
3821,C0yjXQ1iGG,Zero4D: Training-Free 4D Video Generation From Single Video Using Off-the-Shelf Video Diffusion Models,unlabeled,"[2,4,4,6]",Withdraw
13788,h3D4q2y97Z,From Symbolic Perception to Logical Deduction: A Framework for Guiding Language Models in Geometric Reasoning,unlabeled,"[2,2,4,4]",Withdraw
19089,xlr3NqxUqY,Contact-guided Real2Sim from Monocular Video with Planar Scene Primitives,unlabeled,"[2,4,6,8]",Poster
13867,hJlYfenRMC,MaMe: Matrix-Based Token Merging,unlabeled,"[2,2,6,6]",Withdraw
12706,dZKl7uc0XQ,Mirror Flow Matching with Heavy-Tailed Priors for Generative Modeling on Convex Domains,unlabeled,"[4,6,6]",Poster
15188,lHp9ef3kfm,Connecting Independently Trained Modes via Layer-Wise Connectivity,unlabeled,"[2,2,4,6]",Reject
9213,SjPMG7Nwkv,TimesMR: Unlocking the Potential of MLP and RNNs for Multivariate Time Series Forecasting,unlabeled,"[4,4,6]",Reject
10134,VU7wekA9CD,Membership Privacy Risks of Sharpness Aware Minimization,unlabeled,"[2,6,6,8]",Poster
18046,uNZtg4l9dF,Token-Level Early Fusion Model Bridging Text and 3D Electron Density Grids in Chemistry,unlabeled,"[2,2,2,2,4]",Reject
4853,FI075FwAnb,Geometric Constraints for Small Language Models to Understand and Expand Scientific Taxonomies,unlabeled,"[4,4,6,6]",Poster
8610,Qs0BieWYEN,ARROW: An Adaptive Rollout and Routing Method for Global Weather Forecasting,unlabeled,"[4,6,8]",Poster
13186,f4o9OdqAfy,TwinVoice: A Multi-dimensional Benchmark Towards Digital Twins via LLM Persona Simulation,unlabeled,"[2,2,4,6]",Withdraw
4052,CkJcNM2hLG,Analysis of an Idealized Stochastic Polyak Method and its Application to Black-Box Model Distillation,unlabeled,"[4,4,6,6]",Reject
16701,qBMNsGiE3u,Task-Aligned Attention Retrieval for Scaling Tabular Foundation Models,unlabeled,"[2,2,6]",Reject
13880,hMwNfrwHQJ,HCDA: Hierarchical Contrastive Learning with Dynamic Attention Fusion,unlabeled,"[2,2,4,4,4]",Withdraw
9458,TUKrrXWMN2,Granular Information Bottleneck for Deep Multi-modal Clustering,unlabeled,"[2,4,4,4,8]",Withdraw
14078,hvT2vfxD84,Importance Weighted Score Matching for Diffusion Samplers with Enhanced Mode Coverage,unlabeled,"[2,2,2,2]",Withdraw
14120,i2blv7QxtJ,Goal-Oriented Sequential Bayesian Experimental Design for Causal Learning,unlabeled,"[4,4,6,6]",Reject
760,2JilrTRyhh,Transformers as Measure-Theoretic Associative Memory: A Statistical Perspective and Minimax Optimality,unlabeled,"[2,4,8]",Poster
4670,EiJbxZTtDj,Neural Bandit Based Optimal LLM Selection for a Pipeline of Tasks,unlabeled,"[2,4,4,6]",Reject
7981,P479BoN8BD,CoMind: Towards Community-Driven Agents for Machine Learning Engineering,unlabeled,"[2,6,6,6]",Poster
11451,ZiC8bcnYog,"Cross Spline Net: A Simpler, More Interpretable and Unified Machine Learning Framework",unlabeled,"[2,2,4,6]",Reject
13219,fBagP6w6yE,From Natural Alignment to Conditional Controllability in Multimodal Dialogue,unlabeled,"[4,6,6,6]",Poster
17667,t9kQlO9AfI,Cross-Modal Obfuscation for Jailbreak Attacks on Large Vision-Language Models,unlabeled,"[2,2,4]",Withdraw
13942,hWyeiVFZ0q,BrainMoE: Towards Universal EEG Foundation Models with Channel-wise Mixture-of-Experts,unlabeled,"[2,2,4,4]",Withdraw
8424,QLL1EWSsxS,SSR: Socratic Self-Refine for Large Language Model Reasoning,unlabeled,"[2,4,4,8]",Reject
1881,5p1Ucqfd1A,CRAG-MM: Multi-modal Multi-turn Comprehensive RAG Benchmark,unlabeled,"[2,2,4,6]",Reject
2469,7jXxQ9bGoU,GaussianFusion: Unified 3D Gaussian Representation for Multi-Modal Fusion Perception,unlabeled,"[2,4,6,6]",Poster
12044,batDcksZsh,Boosted Trees on a Diet: Compact Models for Resource-Constrained Devices,unlabeled,"[4,4,6,6]",Poster
18032,uLOZyM12LJ,RL Fine-Tuning Heals OOD Forgetting in SFT,unlabeled,"[2,4,6,6]",Reject
11848,axRQkSzR5R,BioDataLab: Towards Generalist Agents for Real-world Biological Data Engineering,unlabeled,"[2,2,2,6]",Reject
3724,BjIfaIbXEJ,Risk-adaptive Activation Steering for Safe Multimodal Large Language Models,unlabeled,"[4,4,4,6]",Withdraw
12528,d3dSicnYkN,MANGO: MANGROVE GLOBAL OBSERVATIONS –A DATASET AND BENCHMARK,unlabeled,"[2,4,6]",Withdraw
13260,fI0AZpfe5e,Enlightenment Period Improving DNN Performance,unlabeled,"[2,4,4,4]",Reject
10479,WhFS8mxWJh,Robust Adversarial Attacks Against Unknown Disturbance via Inverse Gradient Sample,unlabeled,"[4,6,6,6]",Poster
195,0aAfZ4tfPj,MARS: Mamba-driven Adaptive Reordering Scheme for Semantic Occupancy Prediction in Autonomous Driving,unlabeled,"[2,4,4]",Reject
8150,PVwSDvUWtr,GOLD: Global Overview to Local Detail in Efficient Visual Grounding for GUI Agents,unlabeled,"[4,4,6]",Reject
15183,lH60NwUL4K,Inductive Triplet Fine Tuning for Small Language Models,unlabeled,,Desk Reject
7404,NEkYHQSXvQ,AMStraMGRAM : Adaptive Multi-cutoff Strategy Modification for ANaGRAM,unlabeled,"[2,4,6,8]",Reject
6173,JJPAy8mvrQ,SelectLLM – Calibrating LLMs for Selective Prediction: Balancing Coverage and Risk,unlabeled,"[2,2,4,8]",Reject
17325,s2vWrgO4OA,Can Global XAI Methods Reveal Injected Bias in LLMs? SHAP vs Rule Extraction vs RuleSHAP,unlabeled,"[4,4,4,6]",Reject
16398,p7wDMVUJ0b,Rethinking Defense for Computer-Use Agents: Context Deception Attacks are Simple to Defend,unlabeled,"[2,4,6]",Reject
15506,mEMGL1fLOO,DocPruner: A Storage-Efficient Framework for Multi-Vector Visual Document Retrieval via Adaptive Patch-Level Embedding Pruning,unlabeled,"[2,2,6,6]",Reject
4942,FYx7NQHhGS,Learning Interpretable Options by Identifying Reward Diffusion Bottlenecks in Reinforcement Learning,unlabeled,"[2,4,4,6]",Reject
8263,Pv5l6cvfno,Human or Machine? A Preliminary Turing Test for Speech-to-Speech Interaction,unlabeled,"[2,4,8,8]",Poster
15574,mPrCMgIb2A,Guaranteed Top-Adaptive-K in Recommendation,unlabeled,"[2,6,6]",Withdraw
395,17DNmdQ9aU,StableToken: A Noise-Robust Semantic Speech Tokenizer for Resilient SpeechLLMs,unlabeled,"[6,6,8,10]",Poster
7076,MBW6TfupQq,"Growing Winning Subnetworks, Not Pruning Them: A Paradigm for Density Discovery in Sparse Neural Networks",unlabeled,"[2,4,4,4]",Withdraw
1418,4UY1NHG5Ge,Genomic Foundationless Models: Pretraining Does Not Promise Performance,unlabeled,"[4,4,4]",Poster
2830,8w8jzJXjhj,The Logical Expressiveness of Topological Neural Networks,unlabeled,"[2,4,6,6]",Poster
12886,e7pAjJZJWb,Revela: Dense Retriever Learning via Language Modeling,unlabeled,"[6,6,6,8]",Oral
12740,de9kj1BnlY,Catch-Only-One: Non-Transferable Examples for Model-Specific Authorization,unlabeled,"[6,6,6,6]",Desk Reject
8192,PdRWesY4Jm,Lemon: A Unified and Scalable 3D Multimodal Model for Universal Spatial Understanding,unlabeled,"[4,4,4,4]",Desk Reject
15683,mkl9iIXIr2,Online Inventory Optimization in Non-Stationary Environment,unlabeled,"[4,6,6]",Poster
18848,wvxq3qNzHB,PixelThink: Towards Efficient Chain-of-Pixel Reasoning,unlabeled,"[4,4,4,8]",Reject
17581,srwK51PC9G,Towards Novel Metamaterial Discovery via Latent Space Regulation and Exploration,unlabeled,"[2,4,4,4]",Reject
1675,5EwVWttqZ9,Towards Accurate and Calibrated Classification: Regularizing Cross-Entropy From A Generative Perspective,unlabeled,"[2,2,4,6]",Withdraw
9203,SiYNm21ifi,FreeViS: Training-free Video Stylization with Inconsistent References,unlabeled,"[4,6,6,6]",Poster
2724,8XNKIR3CEn,From MNIST to ImageNet: Understanding the Scalability Boundaries of Differentiable Logic Gate Networks,unlabeled,"[0,2,2,4]",Withdraw
5911,IWDpCaSF9Q,"SMAN-Bench: A Cross-System Benchmark for Mobile Agents under Single- and Multi-path, Ambiguous, and Noisy Tasks",unlabeled,"[4,6,6,6]",Poster
1152,3bstHHCWhD,Subset Selection-based Attribution Regularization for Rational and Stable Interpretability,unlabeled,"[4,4,4,4]",Withdraw
3896,CGALrQfkYi,HINT: Hierarchical Interaction Modeling for Autoregressive Multi-Human Motion Generation,unlabeled,"[4,4,4,6]",Reject
15647,mcUWhTcqTx,Distillation Lineage Inspector: Black-Box Auditing of Model Distillation in LLMs,unlabeled,"[4,4,6]",Reject
1244,3tGybflFMm,Intentional-Gesture: Deliever your Thoughts by Gestures for Speech,unlabeled,"[4,4,4,8]",Reject
15658,mee8jLEiwd,Proxy-GS: Efficient 3D Gaussian Splatting via Proxy Mesh,unlabeled,"[2,2,4,6]",Withdraw
13562,gNXZJ9pG3o,Segmentation as a Plug-and-Play Capability for Frozen Multimodal LLMs,unlabeled,"[2,4,4,6]",Withdraw
12747,dfaWjPpxZ0,ViT Fine-tuning Vulnerability to Label Noise,unlabeled,"[2,2,4,6]",Withdraw
7837,OdWkyqnkiS,Contrastive Residual Energy Test-time Adaptation,unlabeled,"[2,4,6,6]",Reject
16160,oKy58UqRLW,An Efficient Global-Local Feature Extraction Architecture for 3D Point Clouds,unlabeled,"[4,4,4,6]",Reject
3842,C5Dgtmk7ho,MI-Grad-CAM: Letting Your Model Reveal What’s Most Informative,unlabeled,"[2,2,4,4]",Withdraw
2949,9IzfArmoHq,Unlearning Evaluation through Subset Statistical Independence,unlabeled,"[2,4,8,8]",Poster
13900,hQ4Ph3TNYK,SG-Gaze: Structurally and Geometrically Consistent Representation Learning for Generalizable 3D Gaze Estimation,unlabeled,"[2,4,4,6]",Desk Reject
11039,YUh1Ly9Cbw,Demystifying MaskGIT Sampler and Beyond: Adaptive Order Selection in Masked Diffusion,unlabeled,"[4,4,4,4]",Reject
224,0eM74HjPQA,Newton Method Revisited: Global Convergence Rates up to $O(1/k^3)$ for Stepsize Schedules and Linesearch Procedures,unlabeled,"[4,4,6,6,6]",Poster
3548,BAOO9H0ehZ,POLO: Preference-Guided Multi-Turn Reinforcement Learning for Lead Optimization,unlabeled,"[2,4,4]",Reject
16435,pFyzqbUiF9,Vid2World: Crafting Video Diffusion Models to Interactive World Models,unlabeled,"[4,4,4,6,8]",Poster
16239,obfPBQ9yFW,ContrastGen: A Multi-agent Contrastive Framework for Hard Retrieval Data Generation,unlabeled,"[4,4,4]",Reject
5054,FtXnVaiaiE,MORSE: A Suite of Programmatically Controllable Multimodal Reasoning Environments with Steerable Difficulty,unlabeled,"[2,4,4]",Desk Reject
3525,B5gEND6CDD,Learning Diverse Textual Contexts for Robust Personalization of Text-to-Image Diffusion Models,unlabeled,"[2,4,6,8]",Withdraw
16050,nxzgr96uyV,Deep Hyperbolic Hierarchical Clustering,unlabeled,"[2,2,2,6]",Withdraw
12152,bvvBOwDQ0c,A Revisit of Total Correlation in Disentangled Variational Auto-Encoder with Partial Disentanglement,unlabeled,"[4,4,4]",Reject
1475,4fm4Rc5fUK,Autoformalizer with Tool Feedback,unlabeled,"[2,6,6]",Reject
7896,Opklkxz4f2,BaRC: Barrier Robustness Certificates for Neural Networks against Data Poisoning and Evasion Attacks,unlabeled,"[2,2,4,6]",Withdraw
2402,7WdY3Cojy9,FRABench and UFEval: Unified Fine-grained Evaluation with Task and Aspect Generalization,unlabeled,"[4,4,6,8]",Oral
1250,3u5Ti1CfzE,RLBenchNet: Benchmarking Neural Architectures with PPO Across Reinforcement Learning Tasks,unlabeled,"[0,2,2,4]",Reject
16894,qiduLvfi63,RAH-LORA: TRAINING-FREE CALIBRATION OF HIGH-INFLUENCE ATTENTION HEADS IN MLLMS,unlabeled,,Desk Reject
5266,GXbTHRBSA4,ACTS: Adaptive Control for Test-time Scaling,unlabeled,"[2,2,4,8]",Reject
2445,7d8FSqgSuk,Context-Free Synthetic Data Mitigates Forgetting,unlabeled,,Desk Reject
8904,RnRHNEeqvI,Decomposing Extrapolative Problem Solving: Spatial Transfer and Length Scaling with Map Worlds,unlabeled,"[2,2,6,6]",Poster
1613,54fRCbXKwS,Towards the Mysteries of Convergent Interaction Representations through DNNs,unlabeled,"[2,2,2,6]",Reject
9057,SEjxNfQTHN,PSC: Efficient Grammar-Constrained Decoding via Parser Stack Classification,unlabeled,"[2,2,4,6]",Reject
13247,fF9alVesJ0,Mitigating Indirect Prompt Injection via Instruction-Following Intent Analysis,unlabeled,"[2,2,4,6]",Reject
5572,HXiIuSIztB,MINED: Probing and Updating with Multimodal Time-Sensitive Knowledge for Large Multimodal Models,unlabeled,"[4,4,6,8]",Withdraw
1203,3kvV1nfWVq,A$^2$FM: An Adaptive Agent Foundation Model for Tool-Aware Hybrid Reasoning,unlabeled,"[4,4,6,6]",Poster
16149,oJgNNBNEJM,LUMINA: Detecting Hallucinations in RAG System with Context–Knowledge Signals,unlabeled,"[6,6,6]",Poster
18624,wBX8a3mVN1,An uncertainty-aware framework for data-efficient multi-view animal pose estimation,unlabeled,"[2,4,4]",Desk Reject
16772,qN0Il4dtGg,HARMAP: Hierarchical Atomic Representation for Materials Property Prediction,unlabeled,"[2,2,4,6]",Reject
